Key,English,German
PROPQUEST_REQUESTBOX_INC_000354,A request for $QUEST_END_ITEM_NAME$s has gone out. Will you accept this quest?,Eine Anfrage für $QUEST_END_ITEM_NAME$s ist rausgegangen. Wirst du diese Aufgabe annehmen?
PROPQUEST_REQUESTBOX_INC_000359,A request for Grrr Bandages has gone out.,Eine Anfrage für das Sammeln von Grrr Bandagen ist eingetroffen. Dies soll die medizinische Versorgung für Patienten sicherstellen.
PROPQUEST_REQUESTBOX_INC_000370,A request for Amperes has gone out,Eine Anfrage für das Sammeln von Ampere welches als Material für Batterien für Lampen gebraucht wird ist eingegangen. Die Dwarpet brauchen sie wenn sie nachts arbeiten.
PROPQUEST_REQUESTBOX_INC_000453,A request has gone out for Boopoison to make an antidote. Will you help?,"Die neuen Ärzte bitten uns, aus Boopoison ein Anästhetikum zu entwickeln. Willst du den Auftrag annehmen?"
PROPQUEST_REQUESTBOX_INC_000458,A request has gone out for $QUEST_END_ITEM_NAME$.,Es wurde eine Anfrage für $QUEST_END_ITEM_NAME$ gestellt.
PROPQUEST_REQUESTBOX_INC_000519,A request has gone out for Rootioe to be used as woodworking material. Will you help?,"Wir haben eine Anfrage aus dem Rathaus, sie benötigen Rootioe, den Grundstoff der Holzverarbeitung, weil die Holzverarbeitung zum erliegen kommt. Willst du den Auftrag annehmen?"
PROPQUEST_REQUESTBOX_INC_000366,You can get $QUEST_END_ITEM_NAME$ from any type of $QUEST_END_ITEM_MON$.,$QUEST_END_ITEM_NAME$ kannst du von jeglicher Art von $QUEST_END_ITEM_MON$ erbeuten.
PROPQUEST_REQUESTBOX_INC_000322,You can collect $QUEST_END_ITEM_NAME$ from all types of $QUEST_END_ITEM_MON$.,Du kannst $QUEST_END_ITEM_NAME$ von allen Typen von $QUEST_END_ITEM_MON$ sammeln.
PROPQUEST_REQUESTBOX_INC_000014,You can collect $QUEST_END_ITEM_NAME$ near a bridge in north.,Du kannst $QUEST_END_ITEM_NAME$ in der Nähe einer Brücke im Norden einsammeln.
PROPQUEST_REQUESTBOX_INC_000025,You can collect Unknown Certificates near the Bangs.,Du kannst Unknown ID in der nähe der Bangs sammeln.
PROPQUEST_REQUESTBOX_INC_000091,You can collect nyanyang near the Giant Nyangnyang.,Du kannst Nyanyang Meat in der Nähe von Giant Nyangnyang unter einem Baum finden.
PROPQUEST_REQUESTBOX_INC_000146,You can collect the office documents near Mias.,Du kannst die Office Documents in der Nähe Mias finden.
PROPQUEST_REQUESTBOX_INC_000301,You do not want to collect them? Okay.,Du willst sie nicht für mich sammeln? Na gut...
PROPQUEST_REQUESTBOX_INC_000369,You need more $QUEST_END_ITEM_NAME$.,Du brauchst mehr $QUEST_END_ITEM_NAME$.
PROPQUEST_REQUESTBOX_INC_000303,You do not have enough $QUEST_END_ITEM_NAME$.,Du hast nicht genug $QUEST_END_ITEM_NAME$.
PROPQUEST_REQUESTBOX_INC_000049,Well done. You have successfully completed the quest.,Gut gemacht. Du hast die Aufgabe erfolgreich abgeschlossen.
PROPQUEST_REQUESTBOX_INC_000357,Good Job! You successfully completed the quest. Take this for your trouble.,Gute Arbeit! Ihr habt die Aufgabe erfolgreich abgeschlossen. Nimm dies für deine Mühe.
PROPQUEST_REQUESTBOX_INC_000362,$QUEST_END_NPC_NAME$ was happy that the quest was completed.,"$QUEST_END_NPC_NAME$ war froh, dass die Aufgabe abgeschlossen wurde."
PROPQUEST_REQUESTBOX_INC_000307,$QUEST_END_NPC_NAME$ was happy to see the quest completed.,"$QUEST_END_NPC_NAME$ war froh, dass die Aufgabe abgeschlossen wurde."
PROPQUEST_REQUESTBOX_INC_000582,$QUEST_END_NPC_NAME$ is very grateful to you for completing this quest.,"$QUEST_END_NPC_NAME$ ist dir sehr dankbar, dass du diese Aufgabe abgeschlossen hast."
PROPQUEST_REQUESTBOX_INC_000001,Party of Is,Party von Is
PROPQUEST_REQUESTBOX_INC_000002,Is needs you to gather Chupim for her party. Will you help?,"Sie braucht dich, um Chupim für ihre Party zu sammeln. Wirst du helfen?"
PROPQUEST_REQUESTBOX_INC_000007,Is asking you to collect Chupim for her party.,"Sie bittet Dich, Chupim für ihre Party zu sammeln."
PROPQUEST_REQUESTBOX_INC_000012,Unknown Situation (1),Unbekannte Situation (1)
PROPQUEST_REQUESTBOX_INC_000013,Flaris Pang needs you collect unknown letters. Will you help?,Flaris Pang bittet dich Unknown Letter zu sammeln. Nimmst du den Auftrag an?
PROPQUEST_REQUESTBOX_INC_000018,Flaris Pang wants you to collect $QUEST_END_ITEM_NAME$.,"Flaris Pang bittet dich, $QUEST_END_ITEM_NAME$ zu sammeln."
PROPQUEST_REQUESTBOX_INC_000024,Flaris Pang needs you to collect Unknown Certificates. Will you help?,Flaris Pang bittet dich Unknown ID zu sammeln. Nimmst du den Auftrag an?
PROPQUEST_REQUESTBOX_INC_000034,Flying Board,Fliegendes Board 
PROPQUEST_REQUESTBOX_INC_000035,Dior needs you to collect Peakyrinds. Will you help?,Dior braucht dich zum Sammeln von Peakyrinds. Wirst du helfen?
PROPQUEST_REQUESTBOX_INC_000040,Dior wants you to collect Peakyrinds.,"Dior möchte, dass Du Peakyrinds sammelst."
PROPQUEST_REQUESTBOX_INC_000045,Fresh Start for Mop,Neue Suche nach Mop
PROPQUEST_REQUESTBOX_INC_000046,House of Children needs you to collect Mop for their children. Will you help?,Das Kinderheim braucht Mop für die Kinder. Nimmst du den Auftrag an?
PROPQUEST_REQUESTBOX_INC_000051,House of Children wants you to collect 3 Mop.,"Das Haus der Kinder möchte, dass du 3 Mop sammelst."
PROPQUEST_REQUESTBOX_INC_000056,Gems for Wands,Gem für Wand
PROPQUEST_REQUESTBOX_INC_000057,Madrigal Magician Union wants you to collect Poporam for their wands. Will you help?,"Die Magiervereinigung Madrigal möchte, dass du Poporam für ihre Zauberstäbe sammelst. Wirst du helfen?"
PROPQUEST_REQUESTBOX_INC_000062,Madrigal Magician Union wants you to collect 4 Poporam.,"Die Madrigal-Magiervereinigung möchte, dass du 4 Poporam sammelst."
PROPQUEST_REQUESTBOX_INC_000067,"Cookie Machine, Valin Baget",Die Keksmaschine von Valin Baget
PROPQUEST_REQUESTBOX_INC_000068,Valin needs you to collect Slain to fuel his Cookie Machine. Will you help?,Valin benötigt Slain für seine Keksmaschine. Nimmst du den Auftrag an?
PROPQUEST_REQUESTBOX_INC_000073,Valin needs you to collect Slain for his cookie machine.,Valin benötigt Slain für seine Keksmaschine.
PROPQUEST_REQUESTBOX_INC_000078,Magic Quill,Magische Feder herstellen
PROPQUEST_REQUESTBOX_INC_000079,Mule wants you to collect Tarin roots so he can make a new magic quill. Will you help?,"Mule möchte, dass du Tarin Roots sammelst, damit er einen neuen magischen Federkiel herstellen kann. Wirst du ihm helfen?"
PROPQUEST_REQUESTBOX_INC_000084,Mule needs you to collect Tarin roots.,"Mule braucht dich, um Tarin-Roots zu sammeln."
PROPQUEST_REQUESTBOX_INC_000089,Lyangglatang,Nyang Steaks
PROPQUEST_REQUESTBOX_INC_000090,Rooney wants you to collect Nyanyangs for her party. Will you help?,"Rooney möchte, dass du Nyanyangs für ihre Party sammelst. Wirst du ihr helfen?"
PROPQUEST_REQUESTBOX_INC_000095,Rooney needs you to collect Nyanyangs.,"Rooney braucht dich, um Nyanyangs zu sammeln."
PROPQUEST_REQUESTBOX_INC_000100,10 Year anniversary gift,Jubiläumsgeschenk
PROPQUEST_REQUESTBOX_INC_000101,Marche wants you to collect Starstones to make a 10 year anniversary gift. Will you help?,"Marche möchte, dass du Starstones sammelst, um ein Geschenk zum 10-jährigen Jubiläum zu machen. Wirst du helfen?"
PROPQUEST_REQUESTBOX_INC_000106,Marche needs Starstones,Marche benötigt Starstones.
PROPQUEST_REQUESTBOX_INC_000111,Liquor for Dunkan,Likör für Dunkan Gondreman
PROPQUEST_REQUESTBOX_INC_000112,Dunkan needs you to collect Golden Wings to make a new liquor. Will you help?,"Dunkan braucht dich, um Golden Wings zu sammeln und einen neuen Likör herzustellen. Wirst du helfen?"
PROPQUEST_REQUESTBOX_INC_000117,Dunkan wants Golden Wings.,Dunkan braucht Golden Wings.
PROPQUEST_REQUESTBOX_INC_000122,Sweet Dessert,Süße Nachspeise für Deadvell
PROPQUEST_REQUESTBOX_INC_000123,Damian needs you to collect Blue Honey to make a new dessert. Will you help?,"Damian braucht dich, um Blue Honey für ein neues Dessert zu sammeln. Wirst du helfen?"
PROPQUEST_REQUESTBOX_INC_000128,Damian needs Blue Honey,Damian benötigt Blue Honey
PROPQUEST_REQUESTBOX_INC_000133,Blessed Doll,Verwunschene Puppe
PROPQUEST_REQUESTBOX_INC_000134,House of Children needs you to collect Mia Dolls as presents for the children. Will you help?,"Das Kinderheim benötigt Mia Dolls, um den Kindern ein Geschenk machen zu können. Nimmst du den Auftrag an?"
PROPQUEST_REQUESTBOX_INC_000139,House of Children wants Mia Dolls.,Das Kinderheim benötigt Mia Dolls um den Kindern ein Geschenk zu machen.
PROPQUEST_REQUESTBOX_INC_000144,Lost Documents,Gestohlene Dokumente
PROPQUEST_REQUESTBOX_INC_000145,Julia needs you to collect office documents stolen by the Mias. Will you help?,"Juria braucht die Dokumente, welche von den Mias gestohlen wurden. Nimmst du den Auftrag an?"
PROPQUEST_REQUESTBOX_INC_000150,Julia wants the office documents that the mia stole.,"Juria braucht Dokumente, welche von den Mias gestohlen wurden."
PROPQUEST_REQUESTBOX_INC_000155,Brightly Burning Flame,Das Hochofenfeuer
PROPQUEST_REQUESTBOX_INC_000156,Bozman needs you to collect furious matches to use at his blast furnace. Will you help?,"Bozman braucht dich, um Furious Match zu sammeln, die er in seinem Hochofen verwenden kann. Wirst du helfen?"
PROPQUEST_REQUESTBOX_INC_000161,Bozman wants furious matches,Boboko benötigt Furious Match.
PROPQUEST_REQUESTBOX_INC_000166,Unknown Situation (2),Unbekannte Situation - Teil 3
PROPQUEST_REQUESTBOX_INC_000167,Flaris Pang needs you to collect unknown letters.,Flaris Pang bittet dich Unknown Letter zu sammeln. Nimmst du den Auftrag an?
PROPQUEST_REQUESTBOX_INC_000172,Flaris Pang needs unknown letters again.,"Flaris Pang bittet dich, Unknown Letter zu sammeln."
PROPQUEST_REQUESTBOX_INC_000177,Delicious Sauce,Die köstliche Remantororo Sauce 
PROPQUEST_REQUESTBOX_INC_000178,Kalin needs you to collect Cardrin to make delicious sauce.,Kathrin benötigt Cardrin um Remantororo Sauce herzustellen. Nimmst du den Auftrag an?
PROPQUEST_REQUESTBOX_INC_000183,Kalin wants Cardrin.,"Kathrin benötigt Cardrin, um Remantororo Sauce herzustellen."
PROPQUEST_REQUESTBOX_INC_000188,Magic Orb,Die magischen Kugeln
PROPQUEST_REQUESTBOX_INC_000189,Martin needs Hammarble to make a Magic Orb. Will you help?,"Martin braucht Hammarble, um eine Zauberkugel herzustellen. Wirst du helfen?"
PROPQUEST_REQUESTBOX_INC_000194,Martin wants Hammarbles.,Martin benötigt Hammarble um magische Kugeln herzustellen.
PROPQUEST_REQUESTBOX_INC_000199,Mark of Bill,Bills Erfolg -Abzeichen von Bill-
PROPQUEST_REQUESTBOX_INC_000200,Bill needs you to collect Gigglande so that he can make his mark. Will you help?,"Bill braucht dich, um Gigglande einzusammeln, damit er sein Zeichen setzen kann. Wirst du ihm helfen?"
PROPQUEST_REQUESTBOX_INC_000205,Bill wants Gigglande.,Bill benötigt Gigglande.
PROPQUEST_REQUESTBOX_INC_000210,Repair Work on Saint Hall,Reparatur der Saint Morning Halle
PROPQUEST_REQUESTBOX_INC_000211,Helena needs you to collect Crescent Stones to repair Saint Hall. Will you help?,Helena benötigt Crescent Stones um die Saint Hall zu reparieren. Nimmst du den Auftrag an?
PROPQUEST_REQUESTBOX_INC_000216,Helena wants $QUEST_END_ITEM_NAME$.,Helena möchte $QUEST_END_ITEM_NAME$.
PROPQUEST_REQUESTBOX_INC_000221,Helping injured animals,Helfe den verletzten Tieren 
PROPQUEST_REQUESTBOX_INC_000222,Madrigal Animal Association needs you to collect Bobands to help their injured animals. Will you help?,Madrigal Tierschutz Verein benötigt Boband um verletzten Tieren zu helfen. Nimmst du den Auftrag an?
PROPQUEST_REQUESTBOX_INC_000227,Madrigal Animal Association wants Bobands.,Madrigal Tierschutz Verein benötigt Boband um verletzten Tieren zu helfen.
PROPQUEST_REQUESTBOX_INC_000232,Strange Collector,Ein merkwürdiger Sammler
PROPQUEST_REQUESTBOX_INC_000233,Strange Collector needs you to collect Dumblings for his collection. Will you help?,Ein seltsamer Sammler möchte Dumbring für seine Sammlung. Nimmst du den Auftrag an?
PROPQUEST_REQUESTBOX_INC_000243,For the Wife,Für die Ehefrau
PROPQUEST_REQUESTBOX_INC_000244,Mayer needs Kalin to make a present for his wife. Will you help?,Mayer möchte seiner Frau ein Geschenk machen und benötigt dafür Kalin. Nimmst du den Auftrag an?
PROPQUEST_REQUESTBOX_INC_000249,Mayer wants Kalin.,Mayer möchte seiner Frau ein Geschenk machen und benötigt dafür Kalin.
PROPQUEST_REQUESTBOX_INC_000254,Weak Heart,Schwaches Herz 
PROPQUEST_REQUESTBOX_INC_000255,Helena needs clock hearts to make a new heart for her sick brother. Will you help?,Helena benötigt Clockheart um ein neues Herz für ihren kranken Bruder zu machen. Nimmst du den Auftrag an?
PROPQUEST_REQUESTBOX_INC_000265,Devil Marble,Marmor des Teufels
PROPQUEST_REQUESTBOX_INC_000266,Bill needs Tomb Marbles to make the Devil Marble. Will you help?,"Bill benötigt Tombmarble um den besten Marmor zu machen, Marmor des Teufels. Nimmst du den Auftrag an?"
PROPQUEST_REQUESTBOX_INC_000271,Bill wants Tomb Marbles.,"Bill benötigt Tombmarbles um den besten Marmor zu machen, Marmor des Teufels."
PROPQUEST_REQUESTBOX_INC_000276,Dream of the Fighter,Traum der Kämpfer
PROPQUEST_REQUESTBOX_INC_000277,Fighter needs you to collect Golden Fists to make a golden glove. Will you help?,Kämpfer wollen Golden Fist um sich goldene Handschuhe zu machen. Nimmst du den Auftrag an?
PROPQUEST_REQUESTBOX_INC_000282,Fighter wants Golden Fists.,Kämpfer wollen Golden Fist um sich goldene Handschuhe zu machen.
PROPQUEST_REQUESTBOX_INC_000287,Marbles for the Son,Murmeln für Kinder
PROPQUEST_REQUESTBOX_INC_000288,Mayer needs orbin to make marbles for his son. Will you help?,Mayer braucht Orbrin um Murmeln für seinen Sohn zu machen. Nimmst du den Auftrag an?
PROPQUEST_REQUESTBOX_INC_000293,Mayer wants orbin.,Mayer braucht Orbrin um Murmeln für seinen Sohn zu machen.
PROPQUEST_REQUESTBOX_INC_000298,Strange Collector (2),Ein merkwürdiger Sammler - Teil 2
PROPQUEST_REQUESTBOX_INC_000299,Strange Collector needs you to collect $QUEST_END_ITEM_NAME$ for his collection. Will you help?,"Ein Seltsamer Sammler braucht dich, um $QUEST_END_ITEM_NAME$ für seine Sammlung zu sammeln. Wirst du helfen?"
PROPQUEST_REQUESTBOX_INC_000304,Strange Collector wants $QUEST_END_ITEM_NAME$.,Der Seltsame Sammler möchte $QUEST_END_ITEM_NAME$.
PROPQUEST_REQUESTBOX_INC_000309,Lens of Olien,Olliens Objektive
PROPQUEST_REQUESTBOX_INC_000310,Olien needs you to collect steam tears to make a new lens. Will you help?,Olien braucht Steamtear um neue Objektive zu machen. Nimmst du den Auftrag an?
PROPQUEST_REQUESTBOX_INC_000315,Olien wants steam tears.,Olien braucht Steamtears um neue Objektive zu machen.
PROPQUEST_REQUESTBOX_INC_000320,Red Muffler,Rotes Halstuch
PROPQUEST_REQUESTBOX_INC_000321,Soldier needs you to collect knightlers to make a new scarf. Will you help?,Soldaten benötigen Knightler um Halstücher zu machen. Nimmst du den Auftrag an?
PROPQUEST_REQUESTBOX_INC_000326,Soldier wants knightler.,Soldaten benötigen Knightler um Halstücher zu machen.
PROPQUEST_REQUESTBOX_INC_000331,Dwarpet Festival,Festival der Dwarpets 
PROPQUEST_REQUESTBOX_INC_000332,The Dwarpet needs you to collect wheeshoes for their festival. Will you help?,Dwarpets benötigen Wheeshoe um sie bei ihren Festival zu benutzen. Nimmst du den Auftrag an?
PROPQUEST_REQUESTBOX_INC_000337,The Dwarpet wants wheesoes.,Dwarpets benötigen Wheeshoe um sie bei ihren Festival zu benutzen.
PROPQUEST_REQUESTBOX_INC_000342,Crane Repair,Angehaltene Kräne.
PROPQUEST_REQUESTBOX_INC_000343,The Erons Industrial Manager needs Droil to repair their crane. Will you help?,Der Manager von Erons Industriegebiet braucht Droil als Treibstoff für seine Kräne. Nimmst du den Auftrag an?
PROPQUEST_REQUESTBOX_INC_000348,Erons want Droils.,Der Manager von Erons Industriegebiet braucht Droil als Treibstoff für seine Kräne.
PROPQUEST_REQUESTBOX_INC_000353,Urgently looking for a Bandage,Dringende Suche nach Bandagen.
PROPQUEST_REQUESTBOX_INC_000364,Portable Power,Tragbare Energie
PROPQUEST_REQUESTBOX_INC_000375,Strange Collector (3),Ein merkwürdiger Sammler - Teil 3
PROPQUEST_REQUESTBOX_INC_000386,Replacement Tires,Reproduzierbare Gummireifen-Kreation
PROPQUEST_REQUESTBOX_INC_000387,The Dwarpet needs you to collect Dumptires to replace his flat tires. Will you help?,Dwarpets bitten uns Dumptire zu sammeln welche an Holzreifen aufgezogen werden können um diese zu schützen. Willst du den Auftrag annehmen?
PROPQUEST_REQUESTBOX_INC_000392,The Dwarpet wants Dumptire.,Dwarpets bitten uns Dumptire zu sammeln welche an Holzreifen aufgezogen werden können um diese zu schützen.
PROPQUEST_REQUESTBOX_INC_000397,Strange Collector (4),Ein merkwürdiger Sammler - Teil 4
PROPQUEST_REQUESTBOX_INC_000398,Mysterious collector needs Garbageton for his collection. Will you help?,Mysteriöser Sammler braucht Garbageton für seine Sammlung. Wirst du helfen?
PROPQUEST_REQUESTBOX_INC_000408,Relics of a Husband,Relikte des Ehemannes 
PROPQUEST_REQUESTBOX_INC_000409,A widow has asked that you collect Eronior so that she can re-make the ring of her husband. Will you help?,"Eine Witwe verlor das Relikt ihres Ehemannes welches ein Juwel an ihren Ring war. Sie bat uns Eronior zu sammeln, welches das Material des Ring Juwels war. Willst du den Auftrag annehmen? "
PROPQUEST_REQUESTBOX_INC_000414,A widow wants some Eronior.,"Eine Witwe verlor das Relikt ihres Ehemannes welches ein Juwel an ihren Ring war. Sie bat uns Eronior zu sammeln, welches das Material des Ring Juwels war."
PROPQUEST_REQUESTBOX_INC_000419,Disguise of Remina,Tarnung von Remine
PROPQUEST_REQUESTBOX_INC_000420,Remina needs you to collect repygle to make a pair of disguising sunglasses. Will you help?,"Remine bittet uns, für sie Repygle zu sammeln. Mit diesen kann sie ihre Sonnenbrille verkleiden. Willst du den Auftrag annehmen?"
PROPQUEST_REQUESTBOX_INC_000425,Remina wants $QUEST_END_ITEM_NAME$.,Remina möchte $QUEST_END_ITEM_NAME$.
PROPQUEST_REQUESTBOX_INC_000430,Beautiful Keil Wallpaper,Wunderschöne Tapete
PROPQUEST_REQUESTBOX_INC_000431,Haven needs you to collect Sycale to re-model the Magic Shop. Will you help?,Heaven hat uns gebeten ihr Sycale zu sammeln welches sie für Tapeten braucht mit denen sie ihren Magieladen verschönern möchte. Willst du den Auftrag annehmen?
PROPQUEST_REQUESTBOX_INC_000436,Heaven wants Sycale.,Heaven hat uns gebeten ihr Sycale zu sammeln welches sie für Tapeten braucht mit denen sie ihren Magieladen verschönern möchte.
PROPQUEST_REQUESTBOX_INC_000441,Strange Collector (5),Ein merkwürdiger Sammler - Teil 5
PROPQUEST_REQUESTBOX_INC_000442,Strange Collector needs $QUEST_END_ITEM_NAME$ for his collection. Will you help?,Der Seltsame Sammler braucht $QUEST_END_ITEM_NAME$ für seine Sammlung. Wirst du helfen?
PROPQUEST_REQUESTBOX_INC_000447,Strange collector want Mong Tear,Der seltsame Sammler möchte eine neue Sammlung. Dieses mal bittet er uns Mongtear für ihn zu sammeln.
PROPQUEST_REQUESTBOX_INC_000452,Anesthetic Needs,Anästhetikum wird gebraucht
PROPQUEST_REQUESTBOX_INC_000463,New Kind of Firework,Neues Feuerwerk
PROPQUEST_REQUESTBOX_INC_000464,The Fireworks Producer needs Bomb Timers to make a new kind of firework. Will you help?,"Der Feuerwerkshersteller bat uns, Bomb Timer für ihn zu sammeln. Es dient als Material für sein neues Feuerwerk. Willst du den Auftrag annehmen?"
PROPQUEST_REQUESTBOX_INC_000465,You get bombtimers from any type of Carrierbomb.,Du kannst sie von allen Carrierbombs sammeln. 
PROPQUEST_REQUESTBOX_INC_000469,The Firework Producer wants Bomb Timers.,Feuerwerk Hersteller bat uns Bombtimer für ihn zu sammeln als Material für sein neues Feuerwerk.
PROPQUEST_REQUESTBOX_INC_000474,Snack for the Children,Kindersnack
PROPQUEST_REQUESTBOX_INC_000475,Bolpor needs Prewing to make some snacks for the children. Will you help?,"Bolpor braucht Prewing, um ein paar Snacks für die Kinder zu machen. Wirst du helfen?"
PROPQUEST_REQUESTBOX_INC_000480,Bolpor wants Prewing.,Bolpor benötigt Prewings.
PROPQUEST_REQUESTBOX_INC_000485,Mushroom Farm of Chitller,Pilzfarm von Andrew 
PROPQUEST_REQUESTBOX_INC_000486,Chitller needs you to collect Poiespore for his mushroom farm will you help?,"Andrew bittet uns Poiespore zu sammeln, welche er für seine Pilzfarm braucht. Willst du den Auftrag annehmen?"
PROPQUEST_REQUESTBOX_INC_000491,Chitller wants Poiespore.,"Andrew bittet uns Poiespore zu sammeln, welche er für seine Pilzfarm braucht."
PROPQUEST_REQUESTBOX_INC_000496,New Yo-Yo,Neues Yoyo
PROPQUEST_REQUESTBOX_INC_000497,An Acrobat master needs you to gather Renyken to make a new Yo-Yo. Will you help?,"Der Acrobat Meister benötigen Renyken, um neue Waffen zu machen. Willst du den Auftrag annehmen?"
PROPQUEST_REQUESTBOX_INC_000502,An Acrobat master wants Renyken.,Acrobat Meister benötigen Renyken um neue Waffen zu machen.
PROPQUEST_REQUESTBOX_INC_000507,Disguise of a Native,Verkleidung der Eingeborenen 
PROPQUEST_REQUESTBOX_INC_000508,Darkon natives need you to collect Tangkask. Will you help?,Darkons Eingeborene bitten uns Tangkask zu sammeln. damit sie vor den gefährlichen Watangka fliehen können. Willst du den Auftrag annehmen?
PROPQUEST_REQUESTBOX_INC_000513,Darkon natives want Tankask.,Darkons Eingeborene bitten uns Tangkask zu sammeln. damit sie vor den gefährlichen Watangka fliehen können.
PROPQUEST_REQUESTBOX_INC_000518,Woodworking Material,Holzverarbeitungsmaterial Fluktuierung
PROPQUEST_REQUESTBOX_INC_000529,The Best Shield,Das beste Schild
PROPQUEST_REQUESTBOX_INC_000530,Remina needs Luchest to make the strongest shield in the world. Will you help?,"Remine bittet uns, Luchest zu sammeln. Sie kann damit den stärksten Schild der Welt machen. Willst du den Auftrag annehmen?"
PROPQUEST_REQUESTBOX_INC_000540,Beauty Contest Award,Schönheitswettbewerb Preis
PROPQUEST_REQUESTBOX_INC_000541,The Madrigal Beauty Contest needs Eronsimint for making an award. Will you help?,Der Madrigal-Schönheitswettbewerb benötigt Eronsimint für die Erstellung eines Preises. Wirst du helfen?
PROPQUEST_REQUESTBOX_INC_000546,The Madrigal Beauty Contest sponsor wants Eronsimint.,Madrigal Schönheitswettbewerb Sponsoren bitten uns Eronsimint zu sammeln um daraus einen Toros als Preis zu machen.
PROPQUEST_REQUESTBOX_INC_000551,Lucky Tool,Werkzeug von Lucky 
PROPQUEST_REQUESTBOX_INC_000552,Lucky needs Hammamer to make a lucky hammer. Will you help?,Lucky bittet uns Hammamer zu sammeln welches er als Material für sein neues Werkzeug benötigt. Willst du den Auftrag annehmen?
PROPQUEST_REQUESTBOX_INC_000557,Lucky wants Hammamer.,Lucky bittet uns Hammamer zu sammeln welches er als Material für sein neues Werkzeug benötigt.
PROPQUEST_REQUESTBOX_INC_000562,Strange Collector (6),Ein merkwürdiger Sammler - Teil 6
PROPQUEST_REQUESTBOX_INC_000573,Request of Lurif,Lurifs Bitte
PROPQUEST_REQUESTBOX_INC_000574,Could you do me a favor? I need Phanbubble. Can you help me please?,Könntest du mir einen Gefallen tun? Ich brauche. Würdest du meiner Bitte nachkommen??
PROPQUEST_REQUESTBOX_INC_000579,Lurif needs many Phanbubbles.,Lurif Bittet dich Phanbubble zu sammeln. Die Anzahl der Phanbubble die sie benötigt ist sehr hoch.
PROPQUEST_REQUESTBOX_INC_000815,Mysterious Magic Material,Mysteriöses magisches Material
PROPQUEST_REQUESTBOX_INC_000816,Magician Master requested you to collect Merahook which is a magic material. Will you accept this request?,"Der Meister der Magie hat dich gebeten, Merahook zu sammeln, ein magisches Material. Wirst du diese Bitte annehmen?"
PROPQUEST_REQUESTBOX_INC_000817,You can collect them from the group of Chimeradon in the Deadwallderness.,Du kannst sie bei der Gruppe der Chimeradon in den toten Wüste sammeln.
PROPQUEST_REQUESTBOX_INC_000826,Avenge Nerky,Rache für Nerky
PROPQUEST_REQUESTBOX_INC_000827,Krinton's pet Bearnerky got killed by the other Bearnerky. Krinton requested you to collect NerkyMane for revenge. Will you accept this request?,"Krintons Haustier Bearnerky wurde von dem anderen Bearnerky getötet. Krinton hat dich gebeten, NerkyMane zu sammeln, um sich zu rächen. Wirst du diese Bitte annehmen?"
PROPQUEST_REQUESTBOX_INC_000828,You can collect them from the group of Bearnerky in the Deadwallderness.,Du kannst sie bei der Gruppe von Bearnerky in der toten Wüste abholen.
PROPQUEST_REQUESTBOX_INC_000837,Bolpor's favor,Bolpors Gunst
PROPQUEST_REQUESTBOX_INC_000838,Bolpor requested you to collect Rincruet for making some special food. Will you accept this request?,"Bolpor hat dich gebeten, Rincruet für die Zubereitung eines besonderen Essens zu sammeln. Wirst du dieser Bitte nachkommen?"
PROPQUEST_REQUESTBOX_INC_000839,You can collect them from the group of Muffrin in the Deadwallderness.,Du kannst sie bei der Gruppe der Muffrin in der toten Wüste sammeln.
PROPQUEST_REQUESTBOX_INC_000848,Toy Materials,Spielzeugmaterialien
PROPQUEST_REQUESTBOX_INC_000849,A toy merchant requested you to collect Popshift for making fancy toys. Will you accept this request?,"Ein Spielzeughändler bittet dich, Popshift für die Herstellung ausgefallener Spielzeuge zu sammeln. Wirst du diese Bitte annehmen?"
PROPQUEST_REQUESTBOX_INC_000850,You can collect them from the group of Popcrank in the Deadwallderness.,Du kannst sie bei der Gruppe von Popcrank in der toten Wüste sammeln.
PROPQUEST_REQUESTBOX_INC_000859,Evil Eyed Red Dragon,Boshafter roter Drache
PROPQUEST_REQUESTBOX_INC_000860,Can you please go find Dragon Tooth of the Meteonyker Dragon for me? The Arena Manager Lay requested 5 of them.,Kannst du bitte den Drachenzahn des Meteonyker-Drachen für mich suchen? Der Arenaleiter Lay hat 5 davon angefordert.
PROPQUEST_REQUESTBOX_INC_000861,"You can collect them from Meteonyker. I heard it's in Dekane Dungeon. Be careful, the Meteonyker is very strong! It's  best if you go with a party!","Du kannst sie von Meteonyker sammeln. Ich habe gehört, dass er sich im Dekane Dungeon befindet. Sei vorsichtig, der Meteonyker ist sehr stark! Es ist am besten, wenn du mit einer Gruppe gehst!"
PROPQUEST_REQUESTBOX_INC_010000,Moth Infestation,Mottenbefall
