Key,English,German
PROPQUEST_REQUESTBOX_INC_020070,The Kyouchish have been injuring many Muran scouts with their corrosive strikes. Their claws are needed to craft a protective remedy.,"Die Kyouchish verletzen viele Muran-Späher mit ihren ätzenden Angriffen. Ihre Krallen werden benötigt, um ein schützendes Mittel herzustellen."
PROPQUEST_REQUESTBOX_INC_020071,Good! Their claws are poisoning our scouts. Bring back 325 $QUEST_END_ITEM_NAME$ from the Kyouchish.,Gut! Ihre Krallen vergiften unsere Späher. Bringe 325 $QUEST_END_ITEM_NAME$ von den Kyouchish zurück.
PROPQUEST_REQUESTBOX_INC_020072,I understand… but we're running out of remedies. Return if you wish to help.,"Ich verstehe… aber uns gehen die Mittel aus. Kehre zurück, wenn du helfen willst."
PROPQUEST_REQUESTBOX_INC_020073,"You're still missing some. The Kyouchish are dangerous, stay careful.","Es fehlen noch einige Krallen. Die Kyouchish sind gefährlich, sei vorsichtig."
PROPQUEST_REQUESTBOX_INC_020074,"Excellent! With these claws, our healers can prepare a proper antidote.",Ausgezeichnet! Mit diesen Krallen können unsere Heiler ein wirksames Gegengift herstellen.
PROPQUEST_REQUESTBOX_INC_020075,The Kanonicus Antidote,Das Kanonicus-Gegengift
PROPQUEST_REQUESTBOX_INC_020076,The Kanonicus carry a natural antidote within their dorsal glands. Kaillun urgently needs it to heal warriors poisoned by the Lycans.,"Die Kanonicus tragen ein natürliches Gegengift in ihren Rückendrüsen. Kaillun benötigt es dringend, um Krieger zu heilen, die von den Lycans vergiftet wurden."
PROPQUEST_REQUESTBOX_INC_020077,Thank you! Their natural antidote is vital for our wounded soldiers. Bring back 325 $QUEST_END_ITEM_NAME$ from the Kanonicus.,Danke! Ihr natürliches Gegengift ist lebenswichtig für unsere verwundeten Soldaten. Bringe 325 $QUEST_END_ITEM_NAME$ von den Kanonicus zurück.
PROPQUEST_REQUESTBOX_INC_020078,A shame… several warriors are still waiting to be treated.,Schade… mehrere Krieger warten noch auf Behandlung.
PROPQUEST_REQUESTBOX_INC_020079,"You don’t have enough yet. Hurry, every drop counts.","Du hast noch nicht genug Gegengift. Beeil dich, jeder Tropfen zählt."
PROPQUEST_REQUESTBOX_INC_020080,"Perfect! Thanks to you, we can finally treat our wounded.",Perfekt! Dank dir können wir endlich unsere Verwundeten behandeln.
PROPQUEST_REQUESTBOX_INC_020081,The Magic Skulls of the Redcloud,Die Magischen Schädel der Redcloud
PROPQUEST_REQUESTBOX_INC_020082,The Redcloud generate a mysterious energy within their skulls. Muran shamans want to study this magic to reinforce the city's protective wards.,"Die Redcloud erzeugen eine mysteriöse Energie in ihren Schädeln. Muran-Schamanen wollen diese Magie studieren, um die Schutzzauber der Stadt zu stärken."
PROPQUEST_REQUESTBOX_INC_020083,Very well! Their skulls contain a mysterious energy. We must study it. Bring back 325 $QUEST_END_ITEM_NAME$ from the Redcloud.,Sehr gut! Ihre Schädel enthalten eine mysteriöse Energie. Wir müssen sie studieren. Bringe 325 $QUEST_END_ITEM_NAME$ von den Redcloud zurück.
PROPQUEST_REQUESTBOX_INC_020084,Alright… but this magic could strengthen our defenses.,In Ordnung… aber diese Magie könnte unsere Verteidigung stärken.
PROPQUEST_REQUESTBOX_INC_020085,You don’t have enough energy-charged skulls yet. Keep going!,Du hast noch nicht genug energiegeladene Schädel. Mach weiter!
PROPQUEST_REQUESTBOX_INC_020086,Excellent work! These skulls are a true source of power.,Ausgezeichnete Arbeit! Diese Schädel sind eine wahre Quelle der Macht.
PROPQUEST_REQUESTBOX_INC_020087,The Devil’s Teeth,Die Zähne des Teufels
PROPQUEST_REQUESTBOX_INC_020088,A strange corruption spreads through Kaillun as Devil Spirits multiply. Their teeth contain a demonic essence the sages wish to seal away.,"Eine seltsame Verderbnis breitet sich durch Kaillun aus, während sich die Teufelsgeister vermehren. Ihre Zähne enthalten eine dämonische Essenz, die die Weisen versiegeln möchten."
PROPQUEST_REQUESTBOX_INC_020089,Be brave! The Devil Spirits are growing in number. Their teeth must be sealed. Bring back 325 $QUEST_END_ITEM_NAME$ from the Devil Spirits.,Sei tapfer! Die Teufelsgeister werden zahlreicher. Ihre Zähne müssen versiegelt werden. Bringe 325 $QUEST_END_ITEM_NAME$ von den Teufelsgeistern zurück.
PROPQUEST_REQUESTBOX_INC_020090,I understand… but their influence spreads further each night. Return carefully.,Ich verstehe… aber ihr Einfluss breitet sich jede Nacht weiter aus. Kehre vorsichtig zurück.
PROPQUEST_REQUESTBOX_INC_020091,Not enough teeth to contain the demonic energy yet. Keep gathering.,"Es sind noch nicht genug Zähne, um die dämonische Energie zu bändigen. Sammle weiter."
PROPQUEST_REQUESTBOX_INC_020092,Very good! These teeth will be purified and neutralized. You’ve done us a great service.,Sehr gut! Diese Zähne werden gereinigt und neutralisiert. Du hast uns einen großen Dienst erwiesen.
PROPQUEST_REQUESTBOX_INC_020093,The Bloodstained Fangs of the Hellhound,Die Blutbefleckten Fangzähne des Höllenhunds
PROPQUEST_REQUESTBOX_INC_020094,"Hellhounds roam dangerously close to Kaillun, and their bloodied fangs leave lingering wounds. The Muran need them to forge weapons capable of driving these beasts back.","Höllenhunde streifen gefährlich nahe an Kaillun, und ihre blutigen Fangzähne hinterlassen schmerzhafte Wunden. Die Muran benötigen sie, um Waffen herzustellen, die diese Bestien zurückdrängen können."
PROPQUEST_REQUESTBOX_INC_020095,Perfect! Their blood-soaked fangs are deadly. Bring back 325 $QUEST_END_ITEM_NAME$ from the Hellhounds to us for forging.,"Perfekt! Ihre blutgetränkten Fangzähne sind tödlich. Bringe 325 $QUEST_END_ITEM_NAME$ von den Höllenhunden zurück, damit wir Waffen schmieden können."
PROPQUEST_REQUESTBOX_INC_020096,Very well… but the Hellhounds still lurk around Kaillun.,Sehr gut… aber die Höllenhunde lauern weiterhin rund um Kaillun.
PROPQUEST_REQUESTBOX_INC_020097,You don’t have enough. Their fangs are essential to forge weapons that can repel them.,"Du hast noch nicht genug Zähne gesammelt. Ihre Fangzähne sind essenziell, um Waffen zu schmieden, die sie abwehren können."
PROPQUEST_REQUESTBOX_INC_020098,"Excellent work! Thanks to you, we can forge weapons worthy of the finest Muran warriors.","Ausgezeichnete Arbeit! Dank dir können wir Waffen schmieden, die den besten Muran-Kriegern würdig sind."
PROPQUEST_REQUESTBOX_INC_020099,$QUEST_END_NPC_NAME$ thanks you from the bottom of his heart! Glory to the Murans!,$QUEST_END_NPC_NAME$ dankt dir von Herzen! Ruhm den Muran!
